64,Parkinson's Disease Subtypes in the Oxford Parkinson Disease Centre (OPDC) Discovery Cohort,Lawton,2015,Consensus,"1. Identifies Parkinson subtypes, 2. Uses unsupervised learning or a data driven approach to generate the clusters (subtypes)",No Exclusion criteria checked,Not clearly stated,0,Yes,1.0,More than one center,1.0,Clinics or research institutions,0,UK Brain Bank Criteria,1,1,Consecutive or random,1.0,The study utilized longitudinal clinical data for clustering and/or association or interaction analyses,1.0,1.0,"The study did provide a follow-up, but did not report this data",The study was cross-sectional or did not inform the follow-up period,0,0,,,"Gender, Ethnicity, Age at disease onset, Disease duration (years) or staging (such as Hoehn & Yahr and Schawb and England scales), Medication Doses, Summarised data from clinical scales (such as mean MDS-UPDRS scores, number of non-motor symptoms)",0,1,1,1,1,1,No,0.0,769,No validation was performed,No,,1,,,,,,,,,Creation,,0,0,0,0,0,1,Oxford Parkinson's Disease Centre (OPDC) cohort study,Europe & Central Asia,"Clinical - Gender, Clinical - Ethnicity, Clinical - Age at disease onset, Clinical - Disease staging, Clinical - Motor Features Obtained Through Rating Scales (tremor), Clinical - Motor Features Obtained Through Rating Scales (bradykinesia), Clinical - Motor Features Obtained Through Rating Scales (rigidity), Clinical - Motor Features Obtained Through Rating Scales (gait and/or posture), Clinical - Motor Features Obtained Through Rating Scales (speech), Clinical - Cognition (memory, attention, executive, visuospatial memory etc), Clinical - Neuropsychiatric (anxiety, depression, impulsivity, delusions, hallucinations etc), Clinical - Sleep (REM sleep behavior disorder, insomnia, daytime sleepiness), Clinical - Anosmia or Hyposmia (absence or loss of the capability to smell), Clinical - Autonomic (gastroparesis, constipation, orthostatic hypotension, urinary incontinence, sexual difficulties), Clinical - Other (pain, fatigue etc)",0.0,"Clinical - Gender, Clinical - Age at disease onset, Clinical - Disease staging, Clinical - Motor Features Obtained Through Rating Scales (tremor), Clinical - Motor Features Obtained Through Rating Scales (bradykinesia), Clinical - Motor Features Obtained Through Rating Scales (rigidity), Clinical - Motor Features Obtained Through Rating Scales (gait and/or posture), Clinical - Motor Features Obtained Through Rating Scales (speech), Clinical - Motor Features Obtained Through Wearable Sensors or other Technical Instruments, Clinical - Cognition (memory, attention, executive, visuospatial memory etc), Clinical - Neuropsychiatric (anxiety, depression, impulsivity, delusions, hallucinations etc), Clinical - Sleep (REM sleep behavior disorder, insomnia, daytime sleepiness), Clinical - Anosmia or Hyposmia (absence or loss of the capability to smell), Clinical - Autonomic (gastroparesis, constipation, orthostatic hypotension, urinary incontinence, sexual difficulties), Clinical - Medication (types and/or dosages), Clinical - Other (pain, fatigue etc)",,"Patient's sex, Patient's age at onset or diagnosis, Levodopa Equivalent Daily Dosage (LEDD) or Medication Usage, UPDRS motor scores, UPDRS non-motor scores, The Clinical Impression of Severity Index for PD (CISIPD), Montreal Cognitive Assessment (MoCA), Mini-Mental State Examination (MMSE), Semantic Fluency Test (e.g. fruits, objects, names etc), Beck Depression Inventory (BDI), Questionnaire for Impulsive-Compulsive Disorders in Parkinson's Disease (QUIP), REM-Sleep Behavior Disorder Screening Questionnaire (RBDSQ), Epworth Sleepiness Scale (ESS), Other clinical scales (not present in this form)",No neuroimaging data was utilized for clustering purposes,,,,,,,,5,"Cluster 1, Cluster 2; Cluster 3; Cluster 4; Cluster 5",195; 179; 160; 145; 90,Unknown,No or not sure,769,0,1,1,1,0,0,0,1,1,0,0,1,0,1,0,0,1,0,0,0,0,0,0,0,0,0,0,0,0,0,0,0,0,0,0,0,1,0,1,1,0,0,0,0,1,0,0,Europe & Central Asia,0,0,0,0,1,0,0
65,Patterns of cortical thinning in nondemented Parkinson's disease patients,Uribe,2016,Consensus,"1. Identifies Parkinson subtypes, 2. Uses unsupervised learning or a data driven approach to generate the clusters (subtypes)",No Exclusion criteria checked,Not clearly stated,0,Yes,1.0,Single center,0.0,Clinics or research institutions,0,UK Brain Bank Criteria,1,1,Convenience,0.0,The study only utilized baseline data,0.0,0.0,The study did no provide follow-up,The study was cross-sectional or did not inform the follow-up period,0,0,,,"Age, Gender, Education, Age at disease onset, Disease duration (years) or staging (such as Hoehn & Yahr and Schawb and England scales), Medication Doses, Summarised data from clinical scales (such as mean MDS-UPDRS scores, number of non-motor symptoms)",0,1,1,1,1,1,No,0.0,88,No validation was performed,Yes,31,1,,,,,,,,,,Creation,0,0,0,0,0,1,No additional datasets aside from the above were utilized,Europe & Central Asia,Neuroimaging - Structural or Volumetric MRI,0.0,"Clinical - Age, Clinical - Gender, Clinical - Age at disease onset, Clinical - Disease staging, Clinical - Motor Features Obtained Through Rating Scales (tremor), Clinical - Motor Features Obtained Through Rating Scales (bradykinesia), Clinical - Motor Features Obtained Through Rating Scales (rigidity), Clinical - Motor Features Obtained Through Rating Scales (gait and/or posture), Clinical - Motor Features Obtained Through Rating Scales (speech), Clinical - Cognition (memory, attention, executive, visuospatial memory etc), Clinical - Neuropsychiatric (anxiety, depression, impulsivity, delusions, hallucinations etc), Clinical - Medication (types and/or dosages), Neuroimaging - Structural or Volumetric MRI",,"Levodopa Equivalent Daily Dosage (LEDD) or Medication Usage, MDS-UPDRS Part III, Hoehn and Yahr Scale or Modified Hoehn and Yahr Scale, Mini-Mental State Examination (MMSE), Judgment of Line Orientation Test, Digit Span Tests (backward and/or symbol span), Symbol Digit Modalities Test, Benton Visual Retention Test (BVRT), Boston Naming Test (BNT), Geriatric Depression Scale (GDS), Beck Depression Inventory (BDI), Other clinical scales (not present in this form)",Neuroimaging data was utilized for clustering purposes and a quality control was performed manually,Clustering,,,,,,,3,The article didn't provide clusters or names for the clusters obtained,30; 29; 29,Unknown,No or not sure,88,0,1,1,0,1,0,0,1,1,0,0,1,0,1,0,0,1,0,0,0,0,0,0,0,0,0,0,0,0,0,0,0,0,0,0,0,0,1,0,0,0,0,0,0,1,0,0,Europe & Central Asia,0,0,0,0,1,0,0
66,Profiling cognitive and neuropsychiatric heterogeneity in Parkinson's disease,van Balkom,2016,Consensus,"1. Identifies Parkinson subtypes, 2. Uses unsupervised learning or a data driven approach to generate the clusters (subtypes)",No Exclusion criteria checked,Not clearly stated,0,No,0.0,Single center,0.0,Clinics or research institutions,0,UK Brain Bank Criteria,1,1,Convenience,0.0,The study only utilized baseline data,0.0,0.0,The study did no provide follow-up,The study was cross-sectional or did not inform the follow-up period,0,0,,,"Age, Gender, Education, Age at disease onset, Disease duration (years) or staging (such as Hoehn & Yahr and Schawb and England scales), Medication Doses",0,0,0,1,1,1,No,0.0,226,No validation was performed,No,,1,,,,,,,,,,Creation,0,0,0,0,0,1,No additional datasets aside from the above were utilized,Europe & Central Asia,"Clinical - Motor Features Obtained Through Rating Scales (tremor), Clinical - Motor Features Obtained Through Rating Scales (bradykinesia), Clinical - Motor Features Obtained Through Rating Scales (rigidity), Clinical - Motor Features Obtained Through Rating Scales (gait and/or posture), Clinical - Motor Features Obtained Through Rating Scales (speech), Clinical - Cognition (memory, attention, executive, visuospatial memory etc), Clinical - Neuropsychiatric (anxiety, depression, impulsivity, delusions, hallucinations etc)",0.0,"Clinical - Age, Clinical - Gender, Clinical - Age at disease onset, Clinical - Disease staging, Clinical - Medication (types and/or dosages)",,"Additional clinical scales not listed here were utilized, Patient's sex, Patient's age, Patient's age at onset or diagnosis, UPDRS motor scores, MDS-UPDRS Part II, MDS-UPDRS Part III, Hoehn and Yahr Scale or Modified Hoehn and Yahr Scale, Mini-Mental State Examination (MMSE), Wechsler Adult Intelligence Scale III (WAIS-III), Other clinical scales (not present in this form)",No neuroimaging data was utilized for clustering purposes,,,,,,,,4,The article didn't provide clusters or names for the clusters obtained,86; 15; 46; 79,Unknown,No or not sure,226,0,1,1,0,1,0,0,1,1,0,0,1,0,0,0,0,1,0,0,0,0,0,0,0,0,0,0,0,0,0,0,0,0,0,0,0,0,1,0,0,0,0,0,0,1,0,0,Europe & Central Asia,0,0,0,0,1,0,0
67,Robust identification of Parkinson's disease subtypes using radiomics and hybrid machine learning,Salmanpour,2021,Consensus,"1. Identifies Parkinson subtypes, 2. Uses unsupervised learning or a data driven approach to generate the clusters (subtypes)",No Exclusion criteria checked,Not clearly stated,0,Yes,1.0,More than one center,1.0,Community or population based,1,Clinical Diagnosis + Positive Dopamine Transporter (DAT) SPECT (PPMI),1,1,Consecutive or random,1.0,The study only utilized baseline data,0.0,0.0,The study did no provide follow-up,The study was cross-sectional or did not inform the follow-up period,0,0,,,None of the mentioned data on the PD population was informed by the study,0,0,0,0,0,0,Yes,1.0,599,No validation was performed,Yes,163,1,,,,,,Creation,,,,,0,0,0,0,0,1,No additional datasets aside from the above were utilized,"Sub-Saharan Africa, Middle East & North Africa, Europe & Central Asia, North America","Clinical - Motor Features Obtained Through Rating Scales (tremor), Clinical - Motor Features Obtained Through Rating Scales (bradykinesia), Clinical - Motor Features Obtained Through Rating Scales (rigidity), Clinical - Motor Features Obtained Through Rating Scales (gait and/or posture), Clinical - Motor Features Obtained Through Rating Scales (speech), Clinical - Cognition (memory, attention, executive, visuospatial memory etc), Clinical - Neuropsychiatric (anxiety, depression, impulsivity, delusions, hallucinations etc), Clinical - Sleep (REM sleep behavior disorder, insomnia, daytime sleepiness), Clinical - Anosmia or Hyposmia (absence or loss of the capability to smell), Clinical - Autonomic (gastroparesis, constipation, orthostatic hypotension, urinary incontinence, sexual difficulties), Neuroimaging - Radiomics, Neuroimaging - Structural or Volumetric MRI, ",0.0,"Clinical - Motor Features Obtained Through Rating Scales (tremor), Clinical - Motor Features Obtained Through Rating Scales (bradykinesia), Clinical - Motor Features Obtained Through Rating Scales (rigidity), Clinical - Motor Features Obtained Through Rating Scales (gait and/or posture), Clinical - Motor Features Obtained Through Rating Scales (speech), Clinical - Cognition (memory, attention, executive, visuospatial memory etc), Clinical - Neuropsychiatric (anxiety, depression, impulsivity, delusions, hallucinations etc), Clinical - Autonomic (gastroparesis, constipation, orthostatic hypotension, urinary incontinence, sexual difficulties), Neuroimaging - Radiomics",,"Patient's sex, Patient's age, Patient's age at onset or diagnosis, Ethnicity, Vital signs (blood pressure [including orthosthatic hypotension tests], cardiac frequency etc), Physical attributes (weight, height), Levodopa Equivalent Daily Dosage (LEDD) or Medication Usage, UPDRS motor scores, UPDRS non-motor scores, MDS-UPDRS Part I, MDS-UPDRS Part II, MDS-UPDRS Part III, Hoehn and Yahr Scale or Modified Hoehn and Yahr Scale, State-Trait Anxiety Inventory for Adults (STAI), Montreal Cognitive Assessment (MoCA), Semantic Fluency Test (e.g. fruits, objects, names etc), Hopkins Verbal Learning Test (HTLV), Digit Span Tests (backward and/or symbol span), Symbol Digit Modalities Test, Benton Visual Retention Test (BVRT), Boston Naming Test (BNT), SCOPA-COG, SCOPA-AUT, SCOPA-Motor, The Hoehn & Yahr Scale (or the modified Hoehn & Yahr), Neuropsychiatric Inventory (NPI), Geriatric Depression Scale (GDS), Beck Depression Inventory (BDI)",Neuroimaging data was utilized for clustering purposes but no quality control was mentioned,Clustering,Clustering,Clustering,,,,Clustering,3,Mild; Moderate; severe,205; 292; 102,Unknown,No or not sure,599,1,0,0,0,0,0,0,0,0,0,0,0,0,0,0,0,0,0,1,0,0,0,0,0,0,0,0,0,0,0,0,0,0,1,0,0,0,0,1,1,0,0,0,0,1,0,1,"Europe & Central Asia, North America",1,1,0,0,1,0,1
68,"Statistically Defined Parkinson's Disease Executive and Memory Cognitive Phenotypes: Demographic, Behavioral, and Structural Neuroimaging Comparisons",Crowley,2021,Consensus,"1. Identifies Parkinson subtypes, 2. Uses unsupervised learning or a data driven approach to generate the clusters (subtypes)",No Exclusion criteria checked,Not clearly stated,0,Yes,1.0,Single center,0.0,Clinics or research institutions,0,UK Brain Bank Criteria,1,1,Convenience,0.0,The study only utilized baseline data,0.0,0.0,The study did no provide follow-up,The study was cross-sectional or did not inform the follow-up period,0,0,,,None of the mentioned data on the PD population was informed by the study,0,0,0,0,0,0,Not sure or clearly stated,0.0,116,58,Yes,65,1,,,,,,,,,,"Creation, Validation",1,1,1,1,0,1,No additional datasets aside from the above were utilized,North America,"Clinical - Cognition (memory, attention, executive, visuospatial memory etc)",0.0,"Clinical - Age, Clinical - Gender, Clinical - Motor Features Obtained Through Rating Scales (tremor), Clinical - Motor Features Obtained Through Rating Scales (bradykinesia), Clinical - Motor Features Obtained Through Rating Scales (rigidity), Clinical - Motor Features Obtained Through Rating Scales (gait and/or posture), Clinical - Motor Features Obtained Through Rating Scales (speech), Clinical - Cognition (memory, attention, executive, visuospatial memory etc), Clinical - Neuropsychiatric (anxiety, depression, impulsivity, delusions, hallucinations etc), Clinical - Medication (types and/or dosages), Neuroimaging - Structural or Volumetric MRI, Neuroimaging - Diffusion Imaging MRI",,"Patient's sex, Patient's age, Patient's age at onset or diagnosis, Levodopa Equivalent Daily Dosage (LEDD) or Medication Usage, MDS-UPDRS Part III, Hoehn and Yahr Scale or Modified Hoehn and Yahr Scale, Mini-Mental State Examination (MMSE), Hopkins Verbal Learning Test (HTLV), Wechsler Adult Intelligence Scale III (WAIS-III), Boston Naming Test (BNT), The Hoehn & Yahr Scale (or the modified Hoehn & Yahr), Other clinical scales (not present in this form)",No neuroimaging data was utilized for clustering purposes,Interpretation / Association,Interpretation / Association,,,Interpretation / Association,,,3,PD Executive; PD Memory; PD Cognitively Well,25; 35; 56,Unknown,No or not sure,116,1,0,0,0,0,0,0,0,0,0,0,0,0,0,0,0,1,0,0,0,0,0,0,0,0,0,0,0,0,0,0,0,0,0,0,0,0,1,0,0,0,0,0,0,0,0,1,North America,0,0,0,0,0,0,1
69,The association between motor subtypes and psychopathology in Parkinson's disease,Reijnders,2009,Consensus,"1. Identifies Parkinson subtypes, 2. Uses unsupervised learning or a data driven approach to generate the clusters (subtypes)",No Exclusion criteria checked,Not clearly stated,0,No,0.0,More than one center,1.0,Clinics or research institutions,0,UK Brain Bank Criteria,1,1,Not sure or clearly stated,0.0,The study only utilized baseline data,0.0,0.0,The study did no provide follow-up,The study was cross-sectional or did not inform the follow-up period,0,0,,,"Age, Disease duration (years) or staging (such as Hoehn & Yahr and Schawb and England scales), Summarised data from clinical scales (such as mean MDS-UPDRS scores, number of non-motor symptoms)",0,0,0,0,0,0,No,0.0,173,173,No,,1,,,,,,,,,,"Creation, Validation",1,1,1,1,0,1,No additional datasets aside from the above were utilized,Europe & Central Asia,"Clinical - Motor Features Obtained Through Rating Scales (tremor), Clinical - Motor Features Obtained Through Rating Scales (bradykinesia), Clinical - Motor Features Obtained Through Rating Scales (rigidity), Clinical - Motor Features Obtained Through Rating Scales (gait and/or posture), Clinical - Neuropsychiatric (anxiety, depression, impulsivity, delusions, hallucinations etc), Clinical - Cognition (memory, attention, executive, visuospatial memory etc), Clinical - Neuropsychiatric (anxiety, depression, impulsivity, delusions, hallucinations etc), Clinical - Other (pain, fatigue etc), Clinical - Autonomic (gastroparesis, constipation, orthostatic hypotension, urinary incontinence, sexual difficulties)",0.0,"Clinical - Age at disease onset, Clinical - Disease staging, Clinical - Motor Features Obtained Through Rating Scales (bradykinesia), Clinical - Motor Features Obtained Through Rating Scales (tremor), Clinical - Motor Features Obtained Through Rating Scales (rigidity), Clinical - Motor Features Obtained Through Rating Scales (gait and/or posture), Clinical - Cognition (memory, attention, executive, visuospatial memory etc), Clinical - Neuropsychiatric (anxiety, depression, impulsivity, delusions, hallucinations etc)",,"UPDRS motor scores, UPDRS non-motor scores, Mini-Mental State Examination (MMSE), The Hoehn & Yahr Scale (or the modified Hoehn & Yahr), Additional clinical scales not listed here were utilized",No neuroimaging data was utilized for clustering purposes,,,,,,,,4,rapid disease progression; young-onset; non-tremor-dominant and psychopathology; tremor-dominant,11; 51; 29; 82,Unknown,No or not sure,173,0,1,0,0,0,0,0,0,1,0,0,0,0,1,0,0,1,0,0,0,0,0,0,0,0,0,0,0,0,0,0,0,0,0,0,0,0,1,0,0,0,0,0,0,1,0,0,Europe & Central Asia,0,0,0,0,1,0,0
70,The Heterogeneity of Early Parkinson's Disease: A Cluster Analysis on Newly Diagnosed Untreated Patients,Erro,2013,Consensus,"1. Identifies Parkinson subtypes, 2. Uses unsupervised learning or a data driven approach to generate the clusters (subtypes)",No Exclusion criteria checked,Not clearly stated,0,Yes,1.0,Single center,0.0,Clinics or research institutions,0,UK Brain Bank Criteria,1,1,Convenience,0.0,The study utilized longitudinal clinical data for clustering and/or association or interaction analyses,1.0,1.0,2,The study was cross-sectional or did not inform the follow-up period,0,1,,2.0,"Age, Gender, Age at disease onset, Disease duration (years) or staging (such as Hoehn & Yahr and Schawb and England scales), Summarised data from clinical scales (such as mean MDS-UPDRS scores, number of non-motor symptoms)",0,0,1,1,1,1,Yes,1.0,100,No validation was performed,No,,1,,,,,,,,,,Creation,0,0,0,0,0,1,No additional datasets aside from the above were utilized,Europe & Central Asia,"Clinical - Motor Features Obtained Through Rating Scales (tremor), Clinical - Motor Features Obtained Through Rating Scales (bradykinesia), Clinical - Motor Features Obtained Through Rating Scales (rigidity), Clinical - Motor Features Obtained Through Rating Scales (gait and/or posture), Clinical - Motor Features Obtained Through Rating Scales (speech), Clinical - Cognition (memory, attention, executive, visuospatial memory etc), Clinical - Neuropsychiatric (anxiety, depression, impulsivity, delusions, hallucinations etc), Clinical - Sleep (REM sleep behavior disorder, insomnia, daytime sleepiness), Clinical - Autonomic (gastroparesis, constipation, orthostatic hypotension, urinary incontinence, sexual difficulties)",0.0,"Clinical - Age, Clinical - Age at disease onset, Clinical - Disease staging, Clinical - Motor Features Obtained Through Rating Scales (tremor), Clinical - Motor Features Obtained Through Rating Scales (bradykinesia), Clinical - Motor Features Obtained Through Rating Scales (rigidity), Clinical - Motor Features Obtained Through Rating Scales (gait and/or posture), Clinical - Motor Features Obtained Through Rating Scales (speech), Clinical - Cognition (memory, attention, executive, visuospatial memory etc), Clinical - Neuropsychiatric (anxiety, depression, impulsivity, delusions, hallucinations etc), Clinical - Sleep (REM sleep behavior disorder, insomnia, daytime sleepiness), Clinical - Autonomic (gastroparesis, constipation, orthostatic hypotension, urinary incontinence, sexual difficulties), Clinical - Medication (types and/or dosages)",,"Levodopa Equivalent Daily Dosage (LEDD) or Medication Usage, MDS-UPDRS Part III, Non-Motor Symptoms Questionnaire (NMSQ), Mini-Mental State Examination (MMSE), Frontal Assessment Battery (FAB), Hospital Anxiety and Depression Scale (HADS)",No neuroimaging data was utilized for clustering purposes,,,,,,,,4,Benign Pure Motor; Benign Mixed Motor-Non-Motor; Non-Motor Dominant; Motor Dominant,21; 32; 27; 20,Unknown,No or not sure,100,0,1,1,0,0,0,0,1,1,0,0,0,0,1,0,0,1,0,0,0,0,0,0,0,0,0,0,0,0,0,0,0,0,0,0,0,0,1,0,0,0,0,0,0,1,0,0,Europe & Central Asia,0,0,0,0,1,0,0
71,The Pathophysiological Correlates of Parkinson's Disease Clinical Subtypes,Belvisi,2020,Consensus,"1. Identifies Parkinson subtypes, 2. Uses unsupervised learning or a data driven approach to generate the clusters (subtypes)",No Exclusion criteria checked,Not clearly stated,0,Yes,1.0,Single center,0.0,Not sure or clearly stated,0,MDS Clinical Criteria,1,1,Not sure or clearly stated,0.0,The study only utilized baseline data,0.0,0.0,The study did no provide follow-up,The study was cross-sectional or did not inform the follow-up period,0,0,,,"Age, Gender, Disease duration (years) or staging (such as Hoehn & Yahr and Schawb and England scales), Summarised data from clinical scales (such as mean MDS-UPDRS scores, number of non-motor symptoms)",0,0,1,1,0,1,Yes,1.0,100,No validation was performed,Yes,50,1,,,,,,,,,,Creation,0,0,0,0,0,1,No additional datasets aside from the above were utilized,Europe & Central Asia,"Clinical - Vital Signs or Neurologic Examination Findings, Clinical - Age, Clinical - Disease staging, Clinical - Motor Features Obtained Through Rating Scales (tremor), Clinical - Motor Features Obtained Through Rating Scales (bradykinesia), Clinical - Motor Features Obtained Through Rating Scales (rigidity), Clinical - Motor Features Obtained Through Rating Scales (gait and/or posture), Clinical - Motor Features Obtained Through Rating Scales (speech), Clinical - Cognition (memory, attention, executive, visuospatial memory etc), Clinical - Sleep (REM sleep behavior disorder, insomnia, daytime sleepiness), Clinical - Autonomic (gastroparesis, constipation, orthostatic hypotension, urinary incontinence, sexual difficulties)",0.0,"Clinical - Age, Clinical - Motor Features Obtained Through Rating Scales (tremor), Clinical - Motor Features Obtained Through Rating Scales (bradykinesia), Clinical - Motor Features Obtained Through Rating Scales (rigidity), Clinical - Motor Features Obtained Through Rating Scales (gait and/or posture), Clinical - Motor Features Obtained Through Rating Scales (speech), Clinical - Motor Features Obtained Through Wearable Sensors or other Technical Instruments, Clinical - Cognition (memory, attention, executive, visuospatial memory etc), Clinical - Autonomic (gastroparesis, constipation, orthostatic hypotension, urinary incontinence, sexual difficulties), Neurophysiology - Electroneuromiography, Neurophysiology - Other, Neurophysiology: Transcranial magnetic stimulation; Kinematic recording of motor performance; Somatosensory temporal discrimination threshold (STDT)",,"Patient's sex, Patient's age, Patient's age at onset or diagnosis, Vital signs (blood pressure [including orthosthatic hypotension tests], cardiac frequency etc), UPDRS motor scores, UPDRS non-motor scores, MDS-UPDRS Part I, MDS-UPDRS Part II, MDS-UPDRS Part III, Non-Motor Symptoms Scale (NNMS), Montreal Cognitive Assessment (MoCA), Semantic Fluency Test (e.g. fruits, objects, names etc), Hopkins Verbal Learning Test (HTLV), Benton Visual Retention Test (BVRT), REM-Sleep Behavior Disorder Screening Questionnaire (RBDSQ)",No neuroimaging data was utilized for clustering purposes,,,,,,,,2,mild motor predominant; diffuse malignant,76; 24,Unknown,No or not sure,100,0,1,1,0,0,0,0,0,1,0,0,0,0,1,0,0,0,1,0,0,0,0,0,0,0,0,0,0,0,0,0,0,0,0,0,0,0,1,0,0,0,0,0,0,1,0,0,Europe & Central Asia,0,0,0,0,1,0,0
