17,Clinical Subtypes of Parkinson's Disease,van Rooden,2011,Consensus,"1. Identifies Parkinson subtypes, 2. Uses unsupervised learning or a data driven approach to generate the clusters (subtypes)",No Exclusion criteria checked,Not clearly stated,0,No,0.0,More than one center,1.0,Clinics or research institutions,0,UK Brain Bank Criteria,1,1,Convenience,0.0,The study only utilized baseline data,0.0,0.0,1,The study was cross-sectional or did not inform the follow-up period,0,0,,1.0,"Age, Gender, Age at disease onset, Disease duration (years) or staging (such as Hoehn & Yahr and Schawb and England scales), Medication Doses, Summarised data from clinical scales (such as mean MDS-UPDRS scores, number of non-motor symptoms)",0,1,1,1,1,1,No,0.0,344,357,No,,1,,,,,,,,,,"Creation, Validation",1,1,1,1,0,1,Clustering: PROPARK | Validation: ELEP,Europe & Central Asia,"Clinical - Motor Features Obtained Through Rating Scales (tremor), Clinical - Motor Features Obtained Through Rating Scales (bradykinesia), Clinical - Motor Features Obtained Through Rating Scales (rigidity), Clinical - Motor Features Obtained Through Rating Scales (gait and/or posture), Clinical - Motor Features Obtained Through Rating Scales (speech), Clinical - Motor Complications (dyskinesia, OFF periods, dystonia, motor fluctuations), Clinical - Cognition (memory, attention, executive, visuospatial memory etc), Clinical - Neuropsychiatric (anxiety, depression, impulsivity, delusions, hallucinations etc), Clinical - Sleep (REM sleep behavior disorder, insomnia, daytime sleepiness), Clinical - Autonomic (gastroparesis, constipation, orthostatic hypotension, urinary incontinence, sexual difficulties)",0.0,"Clinical - Age at disease onset, Clinical - Disease staging, Clinical - Gender, Clinical - Motor Features Obtained Through Rating Scales (tremor), Clinical - Motor Complications (dyskinesia, OFF periods, dystonia, motor fluctuations), Clinical - Cognition (memory, attention, executive, visuospatial memory etc), Clinical - Neuropsychiatric (anxiety, depression, impulsivity, delusions, hallucinations etc), Clinical - Sleep (REM sleep behavior disorder, insomnia, daytime sleepiness), Clinical - Autonomic (gastroparesis, constipation, orthostatic hypotension, urinary incontinence, sexual difficulties)",,"Additional clinical scales not listed here were utilized, Patient's sex, Patient's age, Patient's age at onset or diagnosis, Levodopa Equivalent Daily Dosage (LEDD) or Medication Usage, Hoehn and Yahr Scale or Modified Hoehn and Yahr Scale, SCOPA-COG, SCOPA-AUT, SCOPA-Motor, The Hoehn & Yahr Scale (or the modified Hoehn & Yahr), Beck Depression Inventory (BDI), Other clinical scales (not present in this form)",No neuroimaging data was utilized for clustering purposes,,,,,,,,4,Cluster 1; Cluster 2; Cluster 3; Cluster 4,169; 45; 104; 26,Unknown,No or not sure,344,0,1,1,0,0,0,0,1,1,0,0,1,0,1,0,0,1,0,0,0,0,0,0,0,0,0,0,0,0,0,0,0,0,0,0,0,0,1,0,0,0,0,0,0,1,0,0,Europe & Central Asia,0,0,0,0,1,0,0
18,Clinically relevant connectivity features define three subtypes of Parkinson's disease patients,Guo,2020,Consensus,"1. Identifies Parkinson subtypes, 2. Uses unsupervised learning or a data driven approach to generate the clusters (subtypes)",No Exclusion criteria checked,Not clearly stated,0,No,0.0,Single center,0.0,Clinics or research institutions,0,UK Brain Bank Criteria,1,1,Convenience,0.0,The study only utilized baseline data,0.0,0.0,The study did no provide follow-up,The study was cross-sectional or did not inform the follow-up period,0,0,,,"Age, Gender, Education, Disease duration (years) or staging (such as Hoehn & Yahr and Schawb and England scales), Medication Doses, Summarised data from clinical scales (such as mean MDS-UPDRS scores, number of non-motor symptoms)",0,1,1,1,0,1,No,0.0,134,98,Yes,77,1,,,,,,,,,,"Creation, Validation",1,1,1,1,0,1,No additional datasets aside from the above were utilized,"East Asia & Pacific (China, Japan, Australia)",Neuroimaging - Diffusion Imaging MRI,0.0,"Clinical - Age, Clinical - Gender, Clinical - Age at disease onset, Clinical - Disease staging, Clinical - Motor Features Obtained Through Rating Scales (tremor), Clinical - Motor Features Obtained Through Rating Scales (bradykinesia), Clinical - Motor Features Obtained Through Rating Scales (rigidity), Clinical - Motor Features Obtained Through Rating Scales (gait and/or posture), Clinical - Motor Features Obtained Through Rating Scales (speech), Clinical - Motor Complications (dyskinesia, OFF periods, dystonia, motor fluctuations), Clinical - Cognition (memory, attention, executive, visuospatial memory etc), Clinical - Neuropsychiatric (anxiety, depression, impulsivity, delusions, hallucinations etc), Clinical - Sleep (REM sleep behavior disorder, insomnia, daytime sleepiness), Clinical - Autonomic (gastroparesis, constipation, orthostatic hypotension, urinary incontinence, sexual difficulties), Clinical - Medication (types and/or dosages), Neuroimaging - Other Methods (e.g. neuromelanin-sensitive MRI)",,"Patient's sex, Patient's age, Levodopa Equivalent Daily Dosage (LEDD) or Medication Usage, UPDRS motor scores, MDS-UPDRS Part III, Mini-Mental State Examination (MMSE), The Hoehn & Yahr Scale (or the modified Hoehn & Yahr), Epworth Sleepiness Scale (ESS), Parkinson's Disease Questionnaire 39 Items (PDQ39), Other clinical scales (not present in this form)",Neuroimaging data was utilized for clustering purposes but no quality control was mentioned,,,,"Clustering, Interpretation / Association","Clustering, Interpretation / Association",,,3,severe depression-dominant; severe motor-dominant; mild,53; 37; 44,Unknown,No or not sure,134,0,1,1,0,1,0,0,0,1,0,0,1,0,1,0,0,1,0,0,0,0,0,0,0,0,0,0,0,0,0,0,0,0,0,0,0,0,1,0,0,0,0,1,0,0,0,0,"East Asia & Pacific (China, Japan, Australia)",0,0,1,0,0,0,0
19,Cluster Analysis of Categorical Variables of Parkinson's Disease Patients,Hendricks,2021,Consensus,"1. Identifies Parkinson subtypes, 2. Uses unsupervised learning or a data driven approach to generate the clusters (subtypes)",No Exclusion criteria checked,Not clearly stated,0,Yes,1.0,More than one center,1.0,Community or population based,1,Clinical Diagnosis + Positive Dopamine Transporter (DAT) SPECT (PPMI),1,1,Consecutive or random,1.0,The study only utilized baseline data,0.0,0.0,The study did no provide follow-up,The study was cross-sectional or did not inform the follow-up period,0,0,,,"Age, Gender, Family History, Age at disease onset, Disease duration (years) or staging (such as Hoehn & Yahr and Schawb and England scales), Summarised data from clinical scales (such as mean MDS-UPDRS scores, number of non-motor symptoms)",0,0,1,1,1,1,Yes,1.0,423,No validation was performed,No,,1,,,,,,Creation,,,,,0,0,0,0,0,1,No additional datasets aside from the above were utilized,"Sub-Saharan Africa, Middle East & North Africa, Europe & Central Asia, North America","Clinical - Gender, Clinical - Age at disease onset, Clinical - Disease staging, Clinical - Motor Features Obtained Through Rating Scales (tremor), Clinical - Motor Features Obtained Through Rating Scales (bradykinesia), Clinical - Motor Features Obtained Through Rating Scales (rigidity), Clinical - Other (pain, fatigue etc)",0.0,The study did not provide association / interpretation analyses,,"Patient's sex, Patient's age, Patient's age at onset or diagnosis, UPDRS motor scores",No neuroimaging data was utilized for clustering purposes,,,,,,,,47,#1; #2; #3; #4; #5; #6; #7; #8; #9; #10; #11; #12; #13; #14; #15; #16; #17; #18; #19; #20; #21; #22; #23; #24; #25; #26; #27; #28; #29; #30; #31; #32; #33; #34; #35; #36; #37; #38; #39; #40; #41; #42; #43; #44; #45; #46; #47,1; 1; 1; 1; 1; 1; 1; 1; 1; 1; 1; 2; 2; 3; 3; 3; 3; 3; 3; 3; 3; 4; 4; 4; 4; 4; 6; 7; 7; 7; 7; 7; 9; 9; 9; 10; 11; 12; 14; 14; 16; 17; 19; 21; 21; 33; 38; 66,Unknown,No or not sure,423,0,1,1,0,0,0,1,1,1,0,0,0,0,1,0,0,0,0,1,0,0,0,0,0,0,0,0,0,0,0,0,0,0,1,0,0,0,0,1,1,0,0,0,0,1,0,1,"Europe & Central Asia, North America",1,1,0,0,1,0,1
20,Cluster analysis of cognitive performance in a sample of patients with Parkinson's disease,Souza,2016,Consensus,"1. Identifies Parkinson subtypes, 2. Uses unsupervised learning or a data driven approach to generate the clusters (subtypes)",No Exclusion criteria checked,Not clearly stated,0,Not sure or clearly stated,0.0,Single center,0.0,Clinics or research institutions,0,UK Brain Bank Criteria,1,1,Convenience,0.0,The study only utilized baseline data,0.0,0.0,The study did no provide follow-up,The study was cross-sectional or did not inform the follow-up period,0,0,,,"Age, Education, Disease duration (years) or staging (such as Hoehn & Yahr and Schawb and England scales), Summarised data from clinical scales (such as mean MDS-UPDRS scores, number of non-motor symptoms)",0,0,0,0,0,0,Not sure or clearly stated,0.0,100,No validation was performed,No,,1,,,,,,,,,,Creation,0,0,0,0,0,1,No additional datasets aside from the above were utilized,Latin America & the Caribbean,"Clinical - Cognition (memory, attention, executive, visuospatial memory etc)",0.0,"Clinical - Age, Clinical - Gender, Clinical - Cognition (memory, attention, executive, visuospatial memory etc)",,"Mini-Mental State Examination (MMSE), Semantic Fluency Test (e.g. fruits, objects, names etc), Frontal Assessment Battery (FAB), Digit Span Tests (backward and/or symbol span), Other clinical scales (not present in this form)",No neuroimaging data was utilized for clustering purposes,,,,,,,,3,Cluster 1; Cluster 2; Cluster 3,38; 42; 14,Unknown,No or not sure,100,0,1,0,0,1,0,0,0,1,0,0,0,0,1,0,0,1,0,0,0,0,0,0,0,0,0,0,0,0,0,0,0,0,0,0,0,0,1,0,0,0,0,0,0,0,1,0,Latin America & the Caribbean,0,0,0,0,0,1,0
21,Clustering of Alzheimer's and Parkinson's disease based on genetic burden of shared molecular mechanisms,Emon,2020,Consensus,"1. Identifies Parkinson subtypes, 2. Uses unsupervised learning or a data driven approach to generate the clusters (subtypes)",No Exclusion criteria checked,Not clearly stated,0,Yes,1.0,More than one center,1.0,Community or population based,1,Clinical Diagnosis + Positive Dopamine Transporter (DAT) SPECT (PPMI),1,1,Consecutive or random,1.0,The study utilized longitudinal clinical data for clustering and/or association or interaction analyses,1.0,1.0,"The study did provide a follow-up, but did not report this data",The study was cross-sectional or did not inform the follow-up period,0,0,,,"Age, Gender, Summarised data from clinical scales (such as mean MDS-UPDRS scores, number of non-motor symptoms)",0,0,0,0,0,1,Yes,1.0,358,303,Yes,198,1,,,,,,"Creation, Validation",,,,"Creation, Validation",1,1,1,2,0,2,CLUSTERING: ADNI (Alzheimer's) | VALIDATION:  ADNI (Alzheimer's); ROSMAP (AD); IDIBAPS (AD]; AETIONOMY PD; ICEBERG; DIGPD,"Sub-Saharan Africa, Middle East & North Africa, Europe & Central Asia, North America",Omics - Genomics,0.0,"Clinical - Age, Clinical - Gender, Clinical - Motor Features Obtained Through Rating Scales (tremor), Clinical - Motor Features Obtained Through Rating Scales (bradykinesia), Clinical - Motor Features Obtained Through Rating Scales (rigidity), Clinical - Motor Features Obtained Through Rating Scales (gait and/or posture), Clinical - Motor Features Obtained Through Rating Scales (speech), Clinical - Cognition (memory, attention, executive, visuospatial memory etc), Clinical - Neuropsychiatric (anxiety, depression, impulsivity, delusions, hallucinations etc), Clinical - Sleep (REM sleep behavior disorder, insomnia, daytime sleepiness), Biomarkers (uric acid, LDL, tryglicerides, neurofilament light [Nfl], tau, SAA etc), Neuroimaging - Structural or Volumetric MRI, Neuroimaging - DaTSCAN, Omics - Transcriptomics, Omics - Other (e.g. metabolomics, metagenomics), methylomics",Validates in a merged dataset ADNI+PPMI and also in independent datasets (AETIONOMY PD+DIGPD+ICEBERG),No clinical scales or data were utilized for the subtyping of this article,No neuroimaging data was utilized for clustering purposes,Interpretation / Association,Interpretation / Association,,,,,Interpretation / Association,4,"AKT1;  IL1B, NLRP3, TP53; MTHFR; MAPK9",There are 4 clusters for 4 PD datasets,Unknown,No or not sure,358,0,1,1,0,0,0,0,0,0,0,0,0,0,1,0,0,0,0,1,0,0,0,0,0,0,0,0,0,0,0,0,0,0,1,0,0,0,1,1,1,0,0,0,0,1,0,1,"Europe & Central Asia, North America",1,1,0,0,1,0,1
22,Clustering of Parkinson subtypes reveals strong influence of DRD2 polymorphism and gender,Pelzer,2022,Consensus,"1. Identifies Parkinson subtypes, 2. Uses unsupervised learning or a data driven approach to generate the clusters (subtypes)",No Exclusion criteria checked,Not clearly stated,1,Yes,1.0,Single center,0.0,Clinics or research institutions,0,Other criteria,1,1,Consecutive or random,1.0,The study only utilized baseline data,0.0,0.0,The study did no provide follow-up,The study was cross-sectional or did not inform the follow-up period,0,0,,,"Age, Gender, Age at disease onset, Disease duration (years) or staging (such as Hoehn & Yahr and Schawb and England scales), Genetic Status (monogenic PD, polygenic risk score), Summarised data from clinical scales (such as mean MDS-UPDRS scores, number of non-motor symptoms)",1,0,1,1,1,1,No,0.0,91,No validation was performed,No,,1,,,,,,,,,,Creation,0,0,0,0,0,1,No additional datasets aside from the above were utilized,Europe & Central Asia,"Clinical - Gender, Clinical - Age at disease onset, Clinical - Motor Features Obtained Through Rating Scales (tremor), Clinical - Motor Features Obtained Through Rating Scales (bradykinesia), Clinical - Motor Features Obtained Through Rating Scales (rigidity), Clinical - Medication (types and/or dosages), Omics - Genomics",0.0,"Clinical - Gender, Clinical - Age at disease onset, Clinical - Motor Features Obtained Through Rating Scales (tremor), Clinical - Medication (types and/or dosages)",,"Patient's sex, Patient's age at onset or diagnosis, MDS-UPDRS Part III",No neuroimaging data was utilized for clustering purposes,,,,,,,,3,Cluster 1; Cluster 2; Cluster 3,26; 34; 31,Unknown,No or not sure,91,0,1,1,0,0,0,0,1,1,0,0,0,1,1,0,0,0,0,0,0,0,0,0,0,0,0,1,0,0,0,0,0,0,0,0,0,0,1,0,0,0,0,0,0,1,0,0,Europe & Central Asia,0,0,0,0,1,0,0
23,Clustering Parkinson's and Age-Related Voice Impairment Signal Features for Unsupervised Learning,Rueda,2018,Consensus,"1. Identifies Parkinson subtypes, 2. Uses unsupervised learning or a data driven approach to generate the clusters (subtypes)",No Exclusion criteria checked,Not clearly stated,0,Not sure or clearly stated,0.0,Not sure or clearly stated,0.0,Not sure or clearly stated,0,Not sure or clearly stated,0,0,Not sure or clearly stated,0.0,The study only utilized baseline data,0.0,0.0,The study did no provide follow-up,The study was cross-sectional or did not inform the follow-up period,0,0,,,"Age, Gender",0,0,0,0,0,1,No,0.0,57,No validation was performed,Yes,57,1,,,,,,,,,,Creation,0,0,0,0,0,1,No additional datasets aside from the above were utilized,North America,Clinical - Phonation,0.0,The study did not provide association / interpretation analyses,"This study uses five hierarchical and one partitioning clustering methods. Hierarchical clustering methods include HierarchicalK-Means (HKMeans) , Hierarchical Cluster (HCluster), Agglomerative Nesting (AGNES), Divisive Analysis (DIANA), and Self-Organizing Tree Algorithm (SOTA).",MDS-UPDRS Part III,No neuroimaging data was utilized for clustering purposes,,,,,,,,5,0; 1; 2; 3; 4,3; 82; 22; 2; 5,Unknown,No or not sure,57,0,1,1,0,0,0,0,0,0,0,0,0,0,0,0,0,0,0,0,0,0,0,0,0,0,0,0,1,0,0,0,0,0,0,0,0,0,1,0,0,0,0,0,0,0,0,1,North America,0,0,0,0,0,0,1
24,Cognitive Characteristics Associated with Mild Cognitive Impairment in Parkinson's Disease,McKinlay,2009,Consensus,"1. Identifies Parkinson subtypes, 2. Uses unsupervised learning or a data driven approach to generate the clusters (subtypes)",No Exclusion criteria checked,Not clearly stated,0,Not sure or clearly stated,0.0,More than one center,1.0,Community or population based,1,UK Brain Bank Criteria,1,1,Convenience,0.0,The study only utilized baseline data,0.0,0.0,The study did no provide follow-up,The study was cross-sectional or did not inform the follow-up period,0,0,,,"Age, Education, Age at disease onset, Disease duration (years) or staging (such as Hoehn & Yahr and Schawb and England scales)",0,0,0,0,0,0,No,0.0,40,No validation was performed,No,40,1,,,,,,,,,,Creation,0,0,0,0,0,1,No additional datasets aside from the above were utilized,"East Asia & Pacific (China, Japan, Australia)","Clinical - Cognition (memory, attention, executive, visuospatial memory etc)",0.0,"Clinical - Age, Clinical - Disease staging, Clinical - Motor Features Obtained Through Rating Scales (tremor), Clinical - Cognition (memory, attention, executive, visuospatial memory etc), Clinical - Neuropsychiatric (anxiety, depression, impulsivity, delusions, hallucinations etc)",,No clinical scales or data were utilized for the subtyping of this article,No neuroimaging data was utilized for clustering purposes,,,,,,,,3,NCI; UCI; MCI,19; 9; 12,Unknown,No or not sure,40,0,1,0,0,1,0,0,1,1,0,0,0,0,0,0,0,1,0,0,0,0,0,0,0,0,0,0,0,0,0,0,0,0,0,0,0,0,1,0,0,0,0,1,0,0,0,0,"East Asia & Pacific (China, Japan, Australia)",0,0,1,0,0,0,0
25,Cognitive phenotypes in Parkinson's disease: A latent profile analysis,Barvas,2021,Consensus,"1. Identifies Parkinson subtypes, 2. Uses unsupervised learning or a data driven approach to generate the clusters (subtypes)",No Exclusion criteria checked,Not clearly stated,0,Not sure or clearly stated,0.0,Single center,0.0,Clinics or research institutions,0,UK Brain Bank Criteria,1,1,Convenience,0.0,The study only utilized baseline data,0.0,0.0,The study did no provide follow-up,The study was cross-sectional or did not inform the follow-up period,0,0,,,"Age, Gender, Education, Disease duration (years) or staging (such as Hoehn & Yahr and Schawb and England scales), Medication Doses, Summarised data from clinical scales (such as mean MDS-UPDRS scores, number of non-motor symptoms)",0,1,1,1,0,1,No,0.0,65,No validation was performed,No,,1,,,,,,,,,,Creation,0,0,0,0,0,1,No additional datasets aside from the above were utilized,Europe & Central Asia,"Clinical - Cognition (memory, attention, executive, visuospatial memory etc)",0.0,"Clinical - Age, Clinical - Gender, Clinical - Disease staging, Clinical - Motor Features Obtained Through Rating Scales (tremor), Clinical - Motor Features Obtained Through Rating Scales (bradykinesia), Clinical - Motor Features Obtained Through Rating Scales (rigidity), Clinical - Motor Features Obtained Through Rating Scales (gait and/or posture), Clinical - Motor Features Obtained Through Rating Scales (speech), Clinical - Cognition (memory, attention, executive, visuospatial memory etc), Clinical - Neuropsychiatric (anxiety, depression, impulsivity, delusions, hallucinations etc), Clinical - Medication (types and/or dosages)",,"Semantic Fluency Test (e.g. fruits, objects, names etc), Rey-Osterrieth Complex Figure Test (ROCF), Other clinical scales (not present in this form)",No neuroimaging data was utilized for clustering purposes,,,,,,,,3,Cluster A; Cluster B; Cluster C,14; 35; 16,Unknown,No or not sure,65,0,1,1,0,1,0,0,0,1,0,0,1,0,1,0,0,1,0,0,0,0,0,0,0,0,0,0,0,0,0,0,0,0,0,0,0,0,1,0,0,0,0,0,0,1,0,0,Europe & Central Asia,0,0,0,0,1,0,0
26,Cognitive profiles in Parkinson's disease and their relation to dementia: a data-driven approach,Liepelt-Scarfone,2012,Consensus,"1. Identifies Parkinson subtypes, 2. Uses unsupervised learning or a data driven approach to generate the clusters (subtypes)",No Exclusion criteria checked,PD with specific or special features (either Sporadic / Idiopathic or Monogenic),0,No,0.0,More than one center,1.0,Clinics or research institutions,0,UK Brain Bank Criteria,1,1,Convenience,0.0,The study only utilized baseline data,0.0,0.0,The study did no provide follow-up,The study was cross-sectional or did not inform the follow-up period,0,0,,,"Age, Gender, Age at disease onset, Disease duration (years) or staging (such as Hoehn & Yahr and Schawb and England scales), Medication Doses, Summarised data from clinical scales (such as mean MDS-UPDRS scores, number of non-motor symptoms)",0,1,1,1,1,1,No,0.0,121,97,No,,1,,,,,,,,,,"Creation, Validation",1,1,1,1,0,1,No additional datasets aside from the above were utilized,Europe & Central Asia,"Clinical - Cognition (memory, attention, executive, visuospatial memory etc), Clinical - Neuropsychiatric (anxiety, depression, impulsivity, delusions, hallucinations etc)",0.0,"Clinical - Age, Clinical - Gender, Clinical - Disease staging, Clinical - Motor Features Obtained Through Rating Scales (tremor), Clinical - Motor Features Obtained Through Rating Scales (bradykinesia), Clinical - Motor Features Obtained Through Rating Scales (rigidity), Clinical - Motor Features Obtained Through Rating Scales (gait and/or posture), Clinical - Motor Features Obtained Through Rating Scales (speech), Clinical - Cognition (memory, attention, executive, visuospatial memory etc), Clinical - Neuropsychiatric (anxiety, depression, impulsivity, delusions, hallucinations etc), Clinical - Quality of Life, Clinical - Medication (types and/or dosages)",,"Patient's sex, Patient's age, Levodopa Equivalent Daily Dosage (LEDD) or Medication Usage, MDS-UPDRS Part III, Hoehn and Yahr Scale or Modified Hoehn and Yahr Scale, Mini-Mental State Examination (MMSE), Semantic Fluency Test (e.g. fruits, objects, names etc), The Hoehn & Yahr Scale (or the modified Hoehn & Yahr), Beck Depression Inventory (BDI), Parkinson's Disease Questionnaire 39 Items (PDQ39), Other clinical scales (not present in this form)",No neuroimaging data was utilized for clustering purposes,,,,,,,,2,Cluster-I; Cluster-II,50; 71,Unknown,No or not sure,121,0,1,1,0,0,0,0,1,1,0,0,1,0,1,0,0,1,0,0,0,0,0,0,0,0,0,0,0,0,0,0,0,0,0,0,0,0,1,0,0,0,0,0,0,1,0,0,Europe & Central Asia,0,0,0,0,1,0,0
27,Comprehensive subtyping of Parkinson's disease patients with similarity fusion: a case study with BioFIND data,Brendel,2021,Consensus,"1. Identifies Parkinson subtypes, 2. Uses unsupervised learning or a data driven approach to generate the clusters (subtypes)",No Exclusion criteria checked,Not clearly stated,1,No,0.0,More than one center,1.0,Community or population based,1,UK Brain Bank Criteria,1,1,Consecutive or random,1.0,The study only utilized baseline data,0.0,0.0,The study did no provide follow-up,The study was cross-sectional or did not inform the follow-up period,0,0,,,"Age, Gender, Ethnicity, Education, Family History, Disease duration (years) or staging (such as Hoehn & Yahr and Schawb and England scales), Medication Doses, Genetic Status (monogenic PD, polygenic risk score), Summarised data from clinical scales (such as mean MDS-UPDRS scores, number of non-motor symptoms), Biomarker's profile (results from biomarker tests)",1,1,1,1,0,1,No,0.0,103,No validation was performed,No,,1,,Creation,,,,,,,,,0,0,0,0,0,1,No additional datasets aside from the above were utilized,North America,"Clinical - Age, Clinical - Gender, Clinical - Motor Features Obtained Through Rating Scales (tremor), Clinical - Motor Features Obtained Through Rating Scales (bradykinesia), Clinical - Motor Features Obtained Through Rating Scales (rigidity), Clinical - Motor Features Obtained Through Rating Scales (gait and/or posture), Clinical - Motor Features Obtained Through Rating Scales (speech), dystonia, motor fluctuations), Clinical - Cognition (memory, attention, executive, visuospatial memory etc), Clinical - Neuropsychiatric (anxiety, depression, impulsivity, delusions, hallucinations etc), Clinical - Sleep (REM sleep behavior disorder, insomnia, daytime sleepiness), Clinical - Autonomic (gastroparesis, constipation, orthostatic hypotension, urinary incontinence, sexual difficulties), Clinical - Other (pain, fatigue etc)",0.0,"Clinical - Age, Clinical - Gender, Clinical - Ethnicity, Clinical - Disease staging, Clinical - Motor Features Obtained Through Rating Scales (tremor), Clinical - Motor Features Obtained Through Rating Scales (bradykinesia), Clinical - Motor Features Obtained Through Rating Scales (rigidity), Clinical - Motor Features Obtained Through Rating Scales (gait and/or posture), Clinical - Motor Features Obtained Through Rating Scales (speech), Clinical - Motor Complications (dyskinesia, OFF periods, dystonia, motor fluctuations), Clinical - Cognition (memory, attention, executive, visuospatial memory etc), Clinical - Neuropsychiatric (anxiety, depression, impulsivity, delusions, hallucinations etc), Clinical - Sleep (REM sleep behavior disorder, insomnia, daytime sleepiness), Clinical - Autonomic (gastroparesis, constipation, orthostatic hypotension, urinary incontinence, sexual difficulties), Clinical - Medication (types and/or dosages), Biomarkers (uric acid, LDL, tryglicerides, neurofilament light [Nfl], tau, SAA etc), Omics - Genomics",,"Patient's sex, Patient's age, MDS-UPDRS Part I, MDS-UPDRS Part II, MDS-UPDRS Part III, MDS-UPDRS Part IV, Montreal Cognitive Assessment (MoCA), The Schwab and England ADL (Activities of Daily Living) scale, The Hoehn & Yahr Scale (or the modified Hoehn & Yahr), REM-Sleep Behavior Disorder Screening Questionnaire (RBDSQ)",No neuroimaging data was utilized for clustering purposes,,,,,,,,3,Subtype I; Subtype II; Subtype III,60; 20; 23,Unknown,No or not sure,103,0,1,1,1,1,0,1,0,1,0,0,1,1,1,0,1,1,0,0,0,0,0,0,0,0,0,0,0,0,1,0,0,0,0,0,0,0,0,1,1,0,0,0,0,0,0,1,North America,0,0,0,0,0,0,1
