36,Essential tremor-Parkinson's disease syndrome: clinical characteristics and subtypes using cluster analysis,Hou,2023,Consensus,"1. Identifies Parkinson subtypes, 2. Uses unsupervised learning or a data driven approach to generate the clusters (subtypes)",No Exclusion criteria checked,PD with specific or special features (either Sporadic / Idiopathic or Monogenic),0,Yes,1.0,Single center,0.0,Clinics or research institutions,0,"UK Brain Bank Criteria, Clinical Diagnosis (no specific criteria mentioned - PDBP)",1,1,Convenience,0.0,The study only utilized baseline data,0.0,0.0,The study did no provide follow-up,The study was cross-sectional or did not inform the follow-up period,0,0,,,"Age, Gender, Education, Family History, Vital Signs (blood pressure, cardiac frequency), Summarised data from clinical scales (such as mean MDS-UPDRS scores, number of non-motor symptoms)",0,0,0,0,0,1,Yes,1.0,93,No validation was performed,No,,1,,,,,,,,,,Creation,0,0,0,0,0,1,No additional datasets aside from the above were utilized,"East Asia & Pacific (China, Japan, Australia)","Clinical - Disease staging, Clinical - Motor Features Obtained Through Rating Scales (tremor), Clinical - Motor Features Obtained Through Rating Scales (bradykinesia), Clinical - Motor Features Obtained Through Rating Scales (gait and/or posture), Clinical - Cognition (memory, attention, executive, visuospatial memory etc), Clinical - Neuropsychiatric (anxiety, depression, impulsivity, delusions, hallucinations etc), Clinical - Sleep (REM sleep behavior disorder, insomnia, daytime sleepiness), Clinical - Anosmia or Hyposmia (absence or loss of the capability to smell), Clinical - Autonomic (gastroparesis, constipation, orthostatic hypotension, urinary incontinence, sexual difficulties)",0.0,"Clinical - Disease staging, Clinical - Motor Features Obtained Through Rating Scales (tremor), Clinical - Motor Features Obtained Through Rating Scales (bradykinesia), Clinical - Motor Features Obtained Through Rating Scales (gait and/or posture), Clinical - Neuropsychiatric (anxiety, depression, impulsivity, delusions, hallucinations etc), Clinical - Anosmia or Hyposmia (absence or loss of the capability to smell), Family history",,"UPDRS motor scores, Non-Motor Symptoms Scale (NNMS), Montreal Cognitive Assessment (MoCA), Other clinical scales (not present in this form)",No neuroimaging data was utilized for clustering purposes,,,,,,,,2,ET-PD cluster 1; ET-PD cluster 2; PD,34; 59,Unknown,No or not sure,93,0,1,1,0,1,0,1,0,0,1,0,0,0,1,0,0,1,0,0,1,0,0,0,0,0,0,0,0,0,0,0,0,0,0,0,0,0,1,0,0,0,0,1,0,0,0,0,"East Asia & Pacific (China, Japan, Australia)",0,0,1,0,0,0,0
37,Evidence for subtypes of freezing of gait in Parkinson's disease,Martens,2018,Consensus,"1. Identifies Parkinson subtypes, 2. Uses unsupervised learning or a data driven approach to generate the clusters (subtypes)",No Exclusion criteria checked,PD with specific or special features (either Sporadic / Idiopathic or Monogenic),0,No,0.0,Single center,0.0,Not sure or clearly stated,0,Not sure or clearly stated,0,0,Convenience,0.0,The study only utilized baseline data,0.0,0.0,The study did no provide follow-up,The study was cross-sectional or did not inform the follow-up period,0,0,,,"Age, Gender, Disease duration (years) or staging (such as Hoehn & Yahr and Schawb and England scales), Summarised data from clinical scales (such as mean MDS-UPDRS scores, number of non-motor symptoms)",0,0,1,1,0,1,No,0.0,41,No validation was performed,No,,1,,,,,,,,,,Creation,0,0,0,0,0,1,No additional datasets aside from the above were utilized,"East Asia & Pacific (China, Japan, Australia)",Clinical - Motor Features Obtained Through Rating Scales (gait and/or posture),0.0,"Clinical - Age, Clinical - Gender, Clinical - Disease staging, Clinical - Motor Features Obtained Through Rating Scales (tremor), Clinical - Motor Features Obtained Through Rating Scales (bradykinesia), Clinical - Motor Features Obtained Through Rating Scales (rigidity), Clinical - Motor Features Obtained Through Rating Scales (gait and/or posture), Clinical - Motor Features Obtained Through Rating Scales (speech), Clinical - Cognition (memory, attention, executive, visuospatial memory etc), Clinical - Neuropsychiatric (anxiety, depression, impulsivity, delusions, hallucinations etc)",,"UPDRS motor scores, Mini-Mental State Examination (MMSE), Additional clinical scales not listed here were utilized, Other clinical scales (not present in this form)",No neuroimaging data was utilized for clustering purposes,,,,,,,,3,Asymmetric-Motor; Anxious; Sensory-Attention,13; 15; 13,Unknown,No or not sure,41,0,1,1,0,0,0,0,0,1,0,0,0,0,1,0,0,0,0,0,0,0,0,0,0,0,0,0,1,0,0,0,0,0,0,0,0,0,1,0,0,0,0,1,0,0,0,0,"East Asia & Pacific (China, Japan, Australia)",0,0,1,0,0,0,0
38,Feature selection and machine learning methods for optimal identification and prediction of subtypes in Parkinson's disease,Salmanpour,2021,Consensus,"1. Identifies Parkinson subtypes, 2. Uses unsupervised learning or a data driven approach to generate the clusters (subtypes)",No Exclusion criteria checked,Not clearly stated,0,Yes,1.0,More than one center,1.0,Community or population based,1,Clinical Diagnosis + Positive Dopamine Transporter (DAT) SPECT (PPMI),1,1,Consecutive or random,1.0,The study utilized longitudinal clinical data for clustering and/or association or interaction analyses,1.0,1.0,4,The study was cross-sectional or did not inform the follow-up period,0,2,,4.0,None of the mentioned data on the PD population was informed by the study,0,0,0,0,0,0,Yes,1.0,885,885,No,,1,,,,,,"Creation, Validation",,,,,1,1,1,1,0,1,No additional datasets aside from the above were utilized,"Sub-Saharan Africa, Middle East & North Africa, Europe & Central Asia, North America","Clinical - Vital Signs or Neurologic Examination Findings, Clinical - Age, Clinical - Gender, Clinical - Ethnicity, Clinical - Disease staging, Clinical - Motor Features Obtained Through Rating Scales (tremor), Clinical - Motor Features Obtained Through Rating Scales (bradykinesia), Clinical - Motor Features Obtained Through Rating Scales (rigidity), Clinical - Motor Features Obtained Through Rating Scales (gait and/or posture), Clinical - Motor Features Obtained Through Rating Scales (speech), Clinical - Cognition (memory, attention, executive, visuospatial memory etc), Clinical - Neuropsychiatric (anxiety, depression, impulsivity, delusions, hallucinations etc), Clinical - Sleep (REM sleep behavior disorder, insomnia, daytime sleepiness), Clinical - Autonomic (gastroparesis, constipation, orthostatic hypotension, urinary incontinence, sexual difficulties), Clinical - Anosmia or Hyposmia, Clinical - Other (pain, fatigue etc), Neuroimaging - Structural or Volumetric MRI, Neuroimaging - DaTSCAN, Neuroimaging - Radiomics, Omics - Genomics",0.0,The study did not provide association / interpretation analyses,"It employed multiple strategies and compared among them. In the first part, they employed FSAs to rank features prior to application of clustering: the most optimal combination was obtained via the HMLSs: UDFSA + KMA as well as FSASL + KMA.  They employed multiple Classifier algorithms (CA). Overall, they conclude that combining non-imaging information with SPECT-based radiomics features, and optimal utilization of HMLSs, can robustly identify subtypes in PD and enable appropriate outcome prediction in PD patients.","Additional clinical scales not listed here were utilized, Patient's sex, Patient's age, Ethnicity, Vital signs (blood pressure [including orthosthatic hypotension tests], cardiac frequency etc), Physical attributes (weight, height), MDS-UPDRS Part I, MDS-UPDRS Part II, MDS-UPDRS Part III, MDS-UPDRS Part IV, Hoehn and Yahr Scale or Modified Hoehn and Yahr Scale, University of Pennsylvania Smell Identification Test (UPSIT), State-Trait Anxiety Inventory for Adults (STAI), Montreal Cognitive Assessment (MoCA), Semantic Fluency Test (e.g. fruits, objects, names etc), Hopkins Verbal Learning Test (HTLV), Symbol Digit Modalities Test, SCOPA-AUT, REM-Sleep Behavior Disorder Screening Questionnaire (RBDSQ), RBD Single Question Screen(RBD1Q), Epworth Sleepiness Scale (ESS), Other clinical scales (not present in this form)",Neuroimaging data was utilized for clustering purposes but no quality control was mentioned,,,,,,,Clustering,3,The article didn't provide clusters or names for the clusters obtained,"The article didn't provide clusters, names or numbers of patients in the clusters obtained",Unknown,No or not sure,885,1,0,0,0,0,0,0,0,0,0,0,0,0,0,0,0,0,0,1,0,0,0,0,0,0,0,0,0,0,0,0,0,0,1,0,0,0,0,1,1,0,0,0,0,1,0,1,"Europe & Central Asia, North America",1,1,0,0,1,0,1
39,Fine Motor Assessment With Unsupervised Learning For Personalized Rehabilitation in Parkinson Disease,Rovini,2019,Consensus,"1. Identifies Parkinson subtypes, 2. Uses unsupervised learning or a data driven approach to generate the clusters (subtypes)",No Exclusion criteria checked,Not clearly stated,0,Not sure or clearly stated,0.0,Single center,0.0,Clinics or research institutions,0,Not sure or clearly stated,0,0,Not sure or clearly stated,0.0,The study only utilized baseline data,0.0,0.0,The study did no provide follow-up,The study was cross-sectional or did not inform the follow-up period,0,0,,,"Age, Gender",0,0,0,0,0,1,No,0.0,30,No validation was performed,No,,1,,,,,,,,,,Creation,0,0,0,0,0,1,No additional datasets aside from the above were utilized,Europe & Central Asia,"Clinical - Motor Features Obtained Through Rating Scales (tremor), Clinical - Motor Features Obtained Through Rating Scales (bradykinesia)",0.0,The study did not provide association / interpretation analyses,,MDS-UPDRS Part III,No neuroimaging data was utilized for clustering purposes,,,,,,,,3,CHECK,"The article didn't provide clusters, names or numbers of patients in the clusters obtained",Unknown,No or not sure,30,0,1,1,0,0,0,0,0,0,0,0,0,0,0,0,0,0,0,0,0,0,0,0,0,0,0,0,1,0,0,0,0,0,0,0,0,0,1,0,0,0,0,0,0,1,0,0,Europe & Central Asia,0,0,0,0,1,0,0
40,Free Water Fraction Predicts Cognitive Decline for Individuals with Idiopathic Parkinson's disease,Crowley,2022,Consensus,"1. Identifies Parkinson subtypes, 2. Uses unsupervised learning or a data driven approach to generate the clusters (subtypes)",No Exclusion criteria checked,Not clearly stated,0,Yes,1.0,Single center,0.0,Clinics or research institutions,0,UK Brain Bank Criteria,1,1,Convenience,0.0,The study only utilized baseline data,0.0,0.0,"The study did provide a follow-up, but did not report this data",The study was cross-sectional or did not inform the follow-up period,0,0,,,"Age, Gender, Education, Disease duration (years) or staging (such as Hoehn & Yahr and Schawb and England scales), Summarised data from clinical scales (such as mean MDS-UPDRS scores, number of non-motor symptoms)",0,0,1,1,0,1,No,0.0,112,56,Yes,62,1,,,,,,,,,,Creation,0,0,0,0,0,1,No additional datasets aside from the above were utilized,North America,Neuroimaging - Diffusion Imaging MRI,0.0,"Clinical - Age, Clinical - Gender, Clinical - Motor Features Obtained Through Rating Scales (tremor), Clinical - Motor Features Obtained Through Rating Scales (bradykinesia), Clinical - Motor Features Obtained Through Rating Scales (rigidity), Clinical - Motor Features Obtained Through Rating Scales (gait and/or posture), Clinical - Motor Features Obtained Through Rating Scales (speech), Clinical - Cognition (memory, attention, executive, visuospatial memory etc), Clinical - Neuropsychiatric (anxiety, depression, impulsivity, delusions, hallucinations etc), Clinical - Medication (types and/or dosages)",CHECK,No clinical scales or data were utilized for the subtyping of this article,Neuroimaging data was utilized for clustering purposes but no quality control was mentioned,,,,"Clustering, Interpretation / Association",Clustering,,,3,Low FWF; Medium FWF; High FWF,36; 57; 19,Unknown,No or not sure,112,0,1,1,0,1,0,0,0,1,0,0,0,0,1,0,0,1,0,0,0,0,0,0,0,0,0,0,0,0,0,0,0,0,0,0,0,0,1,0,0,0,0,0,0,0,0,1,North America,0,0,0,0,0,0,1
41,Heterogeneity among patients with Parkinson's disease: cluster analysis and genetic association,Ma,2015,Consensus,"1. Identifies Parkinson subtypes, 2. Uses unsupervised learning or a data driven approach to generate the clusters (subtypes)",No Exclusion criteria checked,Monogenic and Sporadic / Idiopathic,1,No,0.0,More than one center,1.0,Clinics or research institutions,0,UK Brain Bank Criteria,1,1,Convenience,0.0,The study only utilized baseline data,0.0,0.0,The study did no provide follow-up,The study was cross-sectional or did not inform the follow-up period,0,0,,,"Age, Gender, Age at disease onset, Disease duration (years) or staging (such as Hoehn & Yahr and Schawb and England scales), Genetic Status (monogenic PD, polygenic risk score), Summarised data from clinical scales (such as mean MDS-UPDRS scores, number of non-motor symptoms)",1,0,1,1,1,1,No,0.0,1510,No validation was performed,No,,1,,,,,,,,,,Creation,0,0,0,0,0,1,Chinese National Consortium on Neurodegenerative Diseases,"East Asia & Pacific (China, Japan, Australia)","Clinical - Age at disease onset, Clinical - Disease staging, Clinical - Motor Features Obtained Through Rating Scales (tremor), Clinical - Motor Features Obtained Through Rating Scales (bradykinesia), Clinical - Motor Features Obtained Through Rating Scales (rigidity), Clinical - Motor Features Obtained Through Rating Scales (gait and/or posture), Clinical - Cognition (memory, attention, executive, visuospatial memory etc), Clinical - Neuropsychiatric (anxiety, depression, impulsivity, delusions, hallucinations etc), Clinical - Sleep (REM sleep behavior disorder, insomnia, daytime sleepiness), Clinical - Autonomic (gastroparesis, constipation, orthostatic hypotension, urinary incontinence, sexual difficulties)",0.0,"Clinical - Age, Clinical - Gender, Clinical - Age at disease onset, Clinical - Disease staging, Clinical - Motor Features Obtained Through Rating Scales (tremor), Clinical - Motor Features Obtained Through Rating Scales (bradykinesia), Clinical - Motor Features Obtained Through Rating Scales (rigidity), Clinical - Motor Features Obtained Through Rating Scales (gait and/or posture), Clinical - Cognition (memory, attention, executive, visuospatial memory etc), Clinical - Neuropsychiatric (anxiety, depression, impulsivity, delusions, hallucinations etc), Clinical - Sleep (REM sleep behavior disorder, insomnia, daytime sleepiness), Clinical - Autonomic (gastroparesis, constipation, orthostatic hypotension, urinary incontinence, sexual difficulties), Omics - Genomics",,"Patient's sex, Patient's age, UPDRS motor scores, Mini-Mental State Examination (MMSE), The Hoehn & Yahr Scale (or the modified Hoehn & Yahr), Pittsburgh Sleep Quality Index (PSQI), Other clinical scales (not present in this form)",No neuroimaging data was utilized for clustering purposes,,,,,,,,4,"Non-tremor dominant, NTD; (rapid disease progression with late onset, RDP-LO; benign pure motor, BPM; tremor dominant with slow progression, TD-SP ",469; 67; 778; 196,Unknown,No or not sure,1510,0,1,1,0,0,0,0,1,1,0,0,0,1,1,0,0,1,0,0,0,0,0,0,0,0,0,0,0,0,0,0,0,0,0,0,0,0,1,0,0,0,0,1,0,0,0,0,"East Asia & Pacific (China, Japan, Australia)",0,0,1,0,0,0,0
42,Heterogeneity of Parkinson's disease in the early clinical stages using a data driven approach,Lewis,2005,Consensus,"1. Identifies Parkinson subtypes, 2. Uses unsupervised learning or a data driven approach to generate the clusters (subtypes)",No Exclusion criteria checked,Not clearly stated,0,Yes,1.0,Single center,0.0,Clinics or research institutions,0,UK Brain Bank Criteria,1,1,Convenience,0.0,The study only utilized baseline data,0.0,0.0,The study did no provide follow-up,The study was cross-sectional or did not inform the follow-up period,0,0,,,"Age, Gender, Family History, Disease duration, Disease duration (years) or staging (such as Hoehn & Yahr and Schawb and England scales), Medication Doses",0,0,0,1,0,1,No,0.0,120,No validation was performed,No,,1,,,,,,,,,,Creation,0,0,0,0,0,1,No additional datasets aside from the above were utilized,Europe & Central Asia,"Clinical - Age at disease onset, Clinical - Motor Features Obtained Through Rating Scales (tremor), Clinical - Motor Features Obtained Through Rating Scales (bradykinesia), Clinical - Motor Features Obtained Through Rating Scales (rigidity), Clinical - Motor Features Obtained Through Rating Scales (gait and/or posture), Clinical - Motor Features Obtained Through Rating Scales (speech), Clinical - Cognition (memory, attention, executive, visuospatial memory etc), Clinical - Neuropsychiatric (anxiety, depression, impulsivity, delusions, hallucinations etc), Clinical - Medication (types and/or dosages)",0.0,"Clinical - Age at disease onset, Clinical - Motor Features Obtained Through Rating Scales (tremor), Clinical - Motor Features Obtained Through Rating Scales (bradykinesia), Clinical - Motor Features Obtained Through Rating Scales (rigidity), Clinical - Motor Features Obtained Through Rating Scales (gait and/or posture), Clinical - Motor Features Obtained Through Rating Scales (speech), Clinical - Motor Complications (dyskinesia, OFF periods, dystonia, motor fluctuations), Clinical - Cognition (memory, attention, executive, visuospatial memory etc), Clinical - Neuropsychiatric (anxiety, depression, impulsivity, delusions, hallucinations etc)",The study did not provide this type of information,"Patient's age at onset or diagnosis, MDS-UPDRS Part III, Mini-Mental State Examination (MMSE), Semantic Fluency Test (e.g. fruits, objects, names etc), Other clinical scales (not present in this form)",No neuroimaging data was utilized for clustering purposes,,,,,,,,4,younger disease onset; tremor dominant; non-tremor dominant with cognitive impairment and mild depression; rapid disease progression but no cognitive impairment,49; 20; 20; 31,Unknown,No or not sure,120,0,1,1,0,0,0,1,0,1,0,0,1,0,0,0,0,1,0,0,0,0,0,0,0,0,0,0,0,0,0,0,0,0,0,0,0,0,1,0,0,0,0,0,0,1,0,0,Europe & Central Asia,0,0,0,0,1,0,0
43,Hierarchical cluster analysis of multimodal imaging data identifies brain atrophy and cognitive patterns in Parkinson's disease,Inguanzo,2021,Consensus,"1. Identifies Parkinson subtypes, 2. Uses unsupervised learning or a data driven approach to generate the clusters (subtypes)",No Exclusion criteria checked,Not clearly stated,0,No,0.0,Single center,0.0,Clinics or research institutions,0,UK Brain Bank Criteria,1,1,Convenience,0.0,The study only utilized baseline data,0.0,0.0,The study did no provide follow-up,The study was cross-sectional or did not inform the follow-up period,0,0,,,None of the mentioned data on the PD population was informed by the study,0,0,0,0,0,0,No,0.0,62,No validation was performed,Yes,33,1,,,,,,,,,,Creation,0,0,0,0,0,1,No additional datasets aside from the above were utilized,Europe & Central Asia,"Neuroimaging - Structural or Volumetric MRI, Neuroimaging - Diffusion Imaging MRI",0.0,"Clinical - Age, Clinical - Gender, Clinical - Age at disease onset, Clinical - Disease staging, Clinical - Motor Features Obtained Through Rating Scales (tremor), Clinical - Motor Features Obtained Through Rating Scales (bradykinesia), Clinical - Motor Features Obtained Through Rating Scales (rigidity), Clinical - Motor Features Obtained Through Rating Scales (gait and/or posture), Clinical - Motor Features Obtained Through Rating Scales (speech), Clinical - Cognition (memory, attention, executive, visuospatial memory etc), Clinical - Neuropsychiatric (anxiety, depression, impulsivity, delusions, hallucinations etc), Clinical - Anosmia or Hyposmia (absence or loss of the capability to smell), Clinical - Medication (types and/or dosages), Neuroimaging - Structural or Volumetric MRI, Neuroimaging - Diffusion Imaging MRI",,No clinical scales or data were utilized for the subtyping of this article,Neuroimaging data was utilized for clustering purposes but no quality control was mentioned,"Clustering, Interpretation / Association","Clustering, Interpretation / Association",,,"Clustering, Interpretation / Association",,,3,PD1; PD2; PD3,15; 21; 26,Unknown,No or not sure,62,1,0,0,0,0,0,0,0,0,0,0,0,0,0,0,0,1,0,0,0,0,0,0,0,0,0,0,0,0,0,0,0,0,0,0,0,0,1,0,0,0,0,0,0,1,0,0,Europe & Central Asia,0,0,0,0,1,0,0
44,Identification and prediction of Parkinson's disease subtypes and progression using machine learning in two cohorts,Dado,2022,Consensus,"1. Identifies Parkinson subtypes, 2. Uses unsupervised learning or a data driven approach to generate the clusters (subtypes)",No Exclusion criteria checked,Not clearly stated,0,Yes,1.0,More than one center,1.0,Community or population based,1,"Clinical Diagnosis + Positive Dopamine Transporter (DAT) SPECT (PPMI), Clinical Diagnosis (no specific criteria mentioned - PDBP)",1,1,Consecutive or random,1.0,The study utilized longitudinal clinical data for clustering and/or association or interaction analyses,1.0,1.0,5,1,2,2,1.0,5.0,"Age, Gender",0,0,0,0,0,1,Yes,1.0,294,263,Yes,154,1,,,,,,Creation,Validation,,,,1,2,0,1,1,1,No additional datasets aside from the above were utilized,"Sub-Saharan Africa, Middle East & North Africa, Europe & Central Asia, North America","Clinical - Vital Signs or Neurologic Examination Findings, Clinical - Motor Features Obtained Through Rating Scales (tremor), Clinical - Motor Features Obtained Through Rating Scales (bradykinesia), Clinical - Motor Features Obtained Through Rating Scales (rigidity), Clinical - Motor Features Obtained Through Rating Scales (gait and/or posture), Clinical - Motor Features Obtained Through Rating Scales (speech), Clinical - Cognition (memory, attention, executive, visuospatial memory etc), Clinical - Neuropsychiatric (anxiety, depression, impulsivity, delusions, hallucinations etc), Clinical - Sleep (REM sleep behavior disorder, insomnia, daytime sleepiness), Clinical - Autonomic (gastroparesis, constipation, orthostatic hypotension, urinary incontinence, sexual difficulties)",0.0,"Clinical - Vital Signs or Neurologic Examination Findings, Clinical - Motor Features Obtained Through Rating Scales (tremor), Clinical - Motor Features Obtained Through Rating Scales (bradykinesia), Clinical - Motor Features Obtained Through Rating Scales (rigidity), Clinical - Motor Features Obtained Through Rating Scales (gait and/or posture), Clinical - Motor Features Obtained Through Rating Scales (speech), Clinical - Cognition (memory, attention, executive, visuospatial memory etc), Clinical - Neuropsychiatric (anxiety, depression, impulsivity, delusions, hallucinations etc), Clinical - Sleep (REM sleep behavior disorder, insomnia, daytime sleepiness), Clinical - Autonomic (gastroparesis, constipation, orthostatic hypotension, urinary incontinence, sexual difficulties), Biomarkers (uric acid, LDL, tryglicerides, neurofilament light [Nfl], tau, SAA etc), Omics - Genomics",,"MDS-UPDRS Part I, MDS-UPDRS Part II, MDS-UPDRS Part III, State-Trait Anxiety Inventory for Adults (STAI), Montreal Cognitive Assessment (MoCA), Hopkins Verbal Learning Test (HTLV), Judgment of Line Orientation Test, Wechsler Adult Intelligence Scale III (WAIS-III), Symbol Digit Modalities Test, SCOPA-AUT, Geriatric Depression Scale (GDS), Questionnaire for Impulsive-Compulsive Disorders in Parkinson's Disease (QUIP), REM-Sleep Behavior Disorder Screening Questionnaire (RBDSQ), Epworth Sleepiness Scale (ESS)",No neuroimaging data was utilized for clustering purposes,,,,,,,,3,PDvec1; PDvec2; PDvec3,134; 114; 46,Stable,No or not sure,294,0,1,1,0,0,0,0,0,0,0,0,0,0,0,0,0,0,0,1,1,0,0,0,0,0,0,0,0,0,0,0,0,0,1,1,0,0,0,2,1,0,0,0,0,1,0,1,"Europe & Central Asia, North America",1,1,0,0,1,0,1
45,Identification of Parkinson's Disease Subtypes from Resting-State Electroencephalography,Yassine,2023,Consensus,"1. Identifies Parkinson subtypes, 2. Uses unsupervised learning or a data driven approach to generate the clusters (subtypes)",No Exclusion criteria checked,Not clearly stated,0,Not sure or clearly stated,0.0,Single center,0.0,Clinics or research institutions,0,UK Brain Bank Criteria,1,1,Convenience,0.0,The study utilized longitudinal clinical data for clustering and/or association or interaction analyses,1.0,1.0,5,0.83,2,2,0.83,5.0,"Age, Gender, Education, Disease duration (years) or staging (such as Hoehn & Yahr and Schawb and England scales), Medication Doses, Summarised data from clinical scales (such as mean MDS-UPDRS scores, number of non-motor symptoms)",0,1,1,1,0,1,No,0.0,44,No validation was performed,No,,1,,,,,,,,,,Creation,0,0,0,0,0,1,No additional datasets aside from the above were utilized,Europe & Central Asia,Neurophysiology - Electroencephalography,0.0,"Clinical - Age, Clinical - Gender, Clinical - Disease staging, Clinical - Motor Features Obtained Through Rating Scales (tremor), Clinical - Motor Features Obtained Through Rating Scales (bradykinesia), Clinical - Motor Features Obtained Through Rating Scales (rigidity), Clinical - Motor Features Obtained Through Rating Scales (gait and/or posture), Clinical - Motor Features Obtained Through Rating Scales (speech), Clinical - Cognition (memory, attention, executive, visuospatial memory etc), Clinical - Medication (types and/or dosages)",,"Patient's sex, Patient's age, Levodopa Equivalent Daily Dosage (LEDD) or Medication Usage, UPDRS motor scores, MDS-UPDRS Part II, MDS-UPDRS Part III, Montreal Cognitive Assessment (MoCA), Mini-Mental State Examination (MMSE), Semantic Fluency Test (e.g. fruits, objects, names etc), Boston Naming Test (BNT), Other clinical scales (not present in this form)",No neuroimaging data was utilized for clustering purposes,,,,,,,,3,G1 moderate with rapid motor deterioration; G2 moderate; G3 mild to severe,9; 22; 13,Stable,No or not sure,44,0,1,1,0,1,0,0,0,1,0,0,1,0,1,0,0,1,0,0,0,0,0,0,0,0,0,0,0,0,0,0,0,0,0,0,0,0,1,0,0,0,0,0,0,1,0,0,Europe & Central Asia,0,0,0,0,1,0,0
